{
  "schemaVersion": 1,
  "messageType": "ReviewResult",
  "workflowId": "123e4567-e89b-12d3-a456-426614174000",
  "dispatchId": "aaaaaaaaaaaaaaaaaaaaaaaaaaaaaaaaaaaaaaaaaaaaaaaaaaaaaaaaaaaaaaaa",
  "reviewedSnapshot": {
    "repositoryKey": "bbbbbbbbbbbbbbbbbbbbbbbb",
    "pullRequestNumber": 42,
    "baseSha": "cccccccccccccccccccccccccccccccccccccccc",
    "headSha": "dddddddddddddddddddddddddddddddddddddddd"
  },
  "routes": {
    "sourceThreadId": "review-thread",
    "destinationThreadId": "main-thread",
    "hostId": "local"
  },
  "decision": "APPROVE",
  "findings": [],
  "verification": ["unit tests: passed", "head SHA: exact"],
  "limitations": [],
  "merge": {
    "status": "MERGED",
    "url": "https://github.com/example/project/pull/42",
    "sha": "eeeeeeeeeeeeeeeeeeeeeeeeeeeeeeeeeeeeeeee"
  },
  "createdAt": "2026-07-18T12:10:00Z"
}
